{
  "$schema": "http://json-schema.org/draft-07/schema#",
  "title": "ADDIEOutput",
  "type": "object",
  "required": ["analysis", "design", "development", "implementation", "evaluation"],
  "additionalProperties": true,
  "properties": {
    "analysis": {
      "type": "object",
      "additionalProperties": true
    },
    "design": {
      "type": "object",
      "additionalProperties": true
    },
    "development": {
      "type": "object",
      "additionalProperties": true
    },
    "implementation": {
      "type": "object",
      "additionalProperties": true
    },
    "evaluation": {
      "type": "object",
      "additionalProperties": true
    },
    "trajectory": {"type": "object"},
    "metadata": {"type": "object"}
  }
}
