{
  "analysis": {
    "needs_analysis": {
      "problem_definition": "Học sinh Công nghệ Thông tin đang đối mặt với khoảng cách giữa kiến thức lý thuyết về học máy và ứng dụng thực tế. Lý do: Mô hình học máy là lĩnh vực tiên tiến, phức tạp, và cần nhiều hiểu biết để áp dụng thành công. Học sinh có thể biết về các thuật toán nhưng không biết cách thực hiện từ dữ liệu đến mô hình.",
      "performance_analysis": "Khoảng cách giữa kiến thức và thành thạo: Học sinh hiểu lý thuyết nhưng không thể cài đặt mô hình học máy trên Python. Instruction là giải pháp vì học sinh cần hướng dẫn từng bước cụ thể từ chuẩn bị dữ liệu đến đánh giá mô hình.",
      "priority_matrix": {
        "high": [
          "G001",
          "G002"
        ],
        "medium": [
          "G003",
          "G004"
        ],
        "low": []
      },
      "gaps": [
        {
          "id": "G001",
          "description": "Quy trình xây dựng mô hình học máy từ chuẩn bị dữ liệu đến đánh giá chưa được làm rõ"
        },
        {
          "id": "G002",
          "description": "Các mô hình học máy phổ biến (hồi quy tuyến tính, cây quyết định) không được dạy cụ thể"
        },
        {
          "id": "G003",
          "description": "Chứng minh cho học sinh rằng độ đo phù hợp (accuracy, F1, RMSE) quan trọng"
        },
        {
          "id": "G004",
          "description": "Hiểu về hiện tượng quá khớp và cách khắc phục bằng điều chuẩn"
        }
      ]
    },
    "learner_analysis": {
      "target_audience": "Sinh viên Công nghệ Thông tin năm thứ ba",
      "characteristics": [
        "Đại học",
        "Năm thứ ba",
        "Sinh viên",
        "Học sinh",
        "Công nghệ Thông tin"
      ],
      "prior_knowledge": "Lập trình Python cơ bản, xác suất thống kê và đại số tuyến tính",
      "motivation": "Cần kiến thức thực tế để ứng dụng trong công việc sau đại học, có mong muốn học kỹ thuật AI",
      "challenges": [
        "Sự phức tạp của học máy cho người mới",
        "Không có kinh nghiệm sử dụng Python",
        "Challenges trong việc ứng dụng lý thuyết vào thực tế"
      ]
    },
    "context_analysis": {
      "environment": "Học kết hợp: lý thuyết trên lớp, thực hành lập trình Python trên Google Colab",
      "duration": "4 tuần, 30h",
      "resources": [
        "Phòng thực hành máy tính",
        "Google Colab",
        "Hệ thống quản lý học tập (LMS) của trường"
      ],
      "resources_list": [
        "Phòng thực hành máy tính",
        "Google Colab",
        "Hệ thống quản lý học tập (LMS) của trường"
      ],
      "budget": "Không phát sinh chi phí phần mềm",
      "tech_requirements": "Python, scikit-learn, pandas, matplotlib",
      "assessment_type": "Kết hợp đánh giá quá trình và đánh giá cuối khóa",
      "language": "Tiếng Việt",
      "difficulty": "Trung bình",
      "domain": "Công nghệ Thông tin / Trí tuệ nhân tạo",
      "class_size": "Khoảng 40 sinh viên",
      "learner_age": "Từ 20 đến 22 tuổi",
      "institution_type": "Trường đại học kỹ thuật",
      "additional_context": "Toàn bộ sản phẩm thiết kế (mục tiêu, câu hỏi, hoạt động, học liệu, hướng dẫn buổi học) viết bằng tiếng Việt; giữ nguyên thuật ngữ chuyên ngành tiếng Anh khi cần.",
      "constraints": [
        {
          "id": "C001",
          "description": "Học sinh cần được tiếp cận với thiết bị thực hành máy tính và Google Colab"
        },
        {
          "id": "C002",
          "description": "Không có chi phí phần mềm, chỉ sử dụng Python, scikit-learn, pandas, matplotlib"
        },
        {
          "id": "C003",
          "description": "Thời gian 4 tuần, 30h, học kết hợp lý thuyết trên lớp và thực hành"
        },
        {
          "id": "C004",
          "description": "Học liệu cần được xem được trên máy tính và điện thoại"
        },
        {
          "id": "C005",
          "description": "Giao tiếp bằng tiếng Việt, giữ nguyên thuật ngữ chuyên ngành"
        }
      ]
    },
    "task_analysis": {
      "prerequisites": [
        "Lập trình Python cơ bản",
        "Xác suất thống kê",
        "Đại số tuyến tính"
      ],
      "entry_behaviors": [
        "Có kiến thức cơ bản về Python",
        "Hiểu về khái niệm xác suất và thống kê",
        "Có hiểu biết cơ bản về đại số"
      ],
      "initial_objectives": [
        {
          "draft": "Sinh viên sẽ hiểu quy trình xây dựng mô hình học máy",
          "critique": "Nhức được 'hiểu' - cần 'thực hiện' được",
          "revision": "Sinh viên sẽ giải thích được quy trình xây dựng một mô hình học máy có giám sát, từ chuẩn bị dữ liệu đến đánh giá mô hình."
        }
      ],
      "review_summary": "Mục tiêu được xây dựng từ các chủ đề về mô hình học máy, hồi quy tuyến tính, cây quyết định, quá khớp và điều chuẩn trong Python. Mục tiêu là giúp sinh viên giải thích được quy trình xây dựng mô hình từ chuẩn bị dữ liệu đến đánh giá, cài đặt mô hình hồi quy tuyến tính và cây quyết định, đánh giá và so sánh mô hình, nhận diện hiện tượng quá khớp và áp dụng kỹ thuật điều chuẩn.",
      "topics": [
        {
          "id": "T001",
          "topic": "Mô hình học máy có giám sát",
          "subtopics": [
            "Quy trình xây dựng mô hình",
            "Chuẩn bị dữ liệu",
            "Đánh giá mô hình"
          ]
        },
        {
          "id": "T002",
          "topic": "Hồi quy tuyến tính",
          "subtopics": [
            "Thuật toán hồi quy",
            "Tiêu chí đánh giá (accuracy, F1, RMSE)"
          ]
        },
        {
          "id": "T003",
          "topic": "Cây quyết định",
          "subtopics": [
            "Thuật toán cây",
            "Tiêu chí đánh giá (accuracy, F1, RMSE)"
          ]
        },
        {
          "id": "T004",
          "topic": "Quá khớp và điều chuẩn",
          "subtopics": [
            "Hiểu về hiện tượng quá khớp",
            "Kỹ thuật điều chuẩn",
            "Khắc phục"
          ]
        },
        {
          "id": "T005",
          "topic": "Thực hành Python",
          "subtopics": [
            "Sử dụng libraries (scikit-learn, pandas, matplotlib)"
          ]
        }
      ]
    }
  },
  "design": {
    "learning_objectives": [
      {
        "id": "ILO-01",
        "level": "understand",
        "statement": "Sinh viên giải thích được quy trình xây dựng một mô hình học máy có giám sát, bao gồm các bước chuẩn bị dữ liệu, huấn luyện mô hình và đánh giá kết quả.",
        "bloom_verb": "explain"
      },
      {
        "id": "ILO-02",
        "level": "apply",
        "statement": "Sinh viên cài đặt được mô hình hồi quy tuyến tính và cây quyết định bằng Python sử dụng thư viện scikit-learn trên tập dữ liệu mẫu.",
        "bloom_verb": "apply"
      },
      {
        "id": "ILO-03",
        "level": "evaluate",
        "statement": "Sinh viên đánh giá và so sánh hiệu suất của các mô hình học máy bằng các độ đo phù hợp như accuracy, F1, RMSE.",
        "bloom_verb": "evaluate"
      },
      {
        "id": "ILO-04",
        "level": "analyze",
        "statement": "Sinh viên nhận diện được hiện tượng quá khớp khi mô hình học máy hoạt động tốt trên dữ liệu huấn luyện nhưng kém trên dữ liệu mới.",
        "bloom_verb": "analyze"
      },
      {
        "id": "ILO-05",
        "level": "evaluate",
        "statement": "Sinh viên áp dụng được kỹ thuật điều chuẩn (cross-validation) để kiểm tra và cải thiện độ ổn định của mô hình học máy.",
        "bloom_verb": "evaluate"
      }
    ],
    "learning_activities": [
      {
        "activity_name": "Exploring the Machine Learning Pipeline",
        "duration": "15 minutes",
        "description": "Review and explain the three core steps of supervised ML model building: Data Preparation, Model Training, and Model Evaluation. Use a visual timeline to show how each step feeds into the next.",
        "module_id": "MOD-01",
        "materials_needed": "Visual infographic or slide deck showing the ML pipeline lifecycle.",
        "aligned_objectives": [
          "ILO-01",
          "ILO-02"
        ],
        "prepares_for_assessment": [
          "AT-01"
        ],
        "learner_cognitive_process": "understand",
        "prerequisite_activities": [],
        "id": "TLA-0101",
        "plan_set": "AB-MOD-01"
      },
      {
        "activity_name": "Hands-on: Setting Up Linear Regression and Decision Trees in Python",
        "duration": "45 minutes",
        "description": "Students run the provided scikit-learn dataset through linear regression and decision tree models to compare performance metrics. This is a hands-on lab exercise, ensuring they apply the concepts from the module.",
        "module_id": "MOD-01",
        "materials_needed": "Google Colab notebook with the scikit-learn dataset loaded.",
        "aligned_objectives": [
          "ILO-02"
        ],
        "prepares_for_assessment": [
          "AT-01"
        ],
        "learner_cognitive_process": "apply",
        "prerequisite_activities": [],
        "id": "TLA-0102",
        "plan_set": "AB-MOD-01"
      },
      {
        "activity_name": "Performance Analysis and Overfitting Mitigation",
        "duration": "30 minutes",
        "description": "Students interpret accuracy, F1, and RMSE scores from the models. Conduct a cross-validation check for overfitting and apply the hold-out technique to reduce generalization error.",
        "module_id": "MOD-01",
        "materials_needed": "Code snippet demonstrating cross-validation and overfitting metrics.",
        "aligned_objectives": [
          "ILO-02"
        ],
        "prepares_for_assessment": [
          "AT-01"
        ],
        "learner_cognitive_process": "analyze",
        "prerequisite_activities": [
          "TLA-0101"
        ],
        "id": "TLA-0103",
        "plan_set": "AB-MOD-01"
      },
      {
        "activity_name": "1. Thuyết trình về hồi quy tuyến tính",
        "duration": "30 minutes",